{
  "id": "video_005",
  "title": "Why Is Traffic Always Bad at the Same Time?",
  "template": "protest",
  "fps": 30,
  "width": 1080,
  "height": 1920,
  "category": "EVERYDAY SYSTEMS",
  "accentColor": "#38bdf8",
  "scenes": [
    {
      "text": "Why Is Traffic Always Bad at the Same Time?",
      "subtext": "Deconstructing the invisible machinery.",
      "duration": 300,
      "visual": "crowd",
      "action": "slow_zoom_in",
      "category": "EVERYDAY SYSTEMS",
      "accentColor": "#38bdf8",
      "palette": {
        "background": "#0f172a",
        "secondary": "#1e293b"
      },
      "assetTags": [
        "home",
        "cart",
        "transport",
        "people",
        "factory"
      ],
      "crowdCount": 15,
      "mood": "neutral"
    },
    {
      "text": "Hook",
      "subtext": "How the architecture of Why Is Traffic Always Bad at the Same Time? impacts your daily life.",
      "duration": 300,
      "visual": "icons",
      "action": "pan_right",
      "category": "EVERYDAY SYSTEMS",
      "accentColor": "#38bdf8",
      "palette": {
        "background": "#0f172a",
        "secondary": "#1e293b"
      },
      "assetTags": [
        "home",
        "cart",
        "transport",
        "people",
        "factory"
      ],
      "icons": [
        "home",
        "cart",
        "transport",
        "bank",
        "factory",
        "home"
      ]
    },
    {
      "text": "System boundary",
      "subtext": "Defining the strict boundaries of the architecture.",
      "duration": 300,
      "visual": "network",
      "action": "static_focus",
      "category": "EVERYDAY SYSTEMS",
      "accentColor": "#38bdf8",
      "palette": {
        "background": "#0f172a",
        "secondary": "#1e293b"
      },
      "assetTags": [
        "home",
        "cart",
        "transport",
        "people",
        "factory"
      ],
      "networkNodes": [
        "State",
        "Market",
        "Labor",
        "Capital",
        "Public"
      ]
    },
    {
      "text": "Cause layer 1",
      "subtext": "At its core, this is what fuels the entire process.",
      "duration": 300,
      "visual": "math_equation",
      "action": "slow_zoom_in",
      "category": "EVERYDAY SYSTEMS",
      "accentColor": "#38bdf8",
      "palette": {
        "background": "#0f172a",
        "secondary": "#1e293b"
      },
      "assetTags": [
        "home",
        "cart",
        "transport",
        "people",
        "factory"
      ]
    },
    {
      "text": "Cause layer 2",
      "subtext": "Tracing the flow of cause and effect.",
      "duration": 300,
      "visual": "flow",
      "action": "pan_left",
      "category": "EVERYDAY SYSTEMS",
      "accentColor": "#38bdf8",
      "palette": {
        "background": "#0f172a",
        "secondary": "#1e293b"
      },
      "assetTags": [
        "home",
        "cart",
        "transport",
        "people",
        "factory"
      ],
      "flowLabels": [
        "Trigger",
        "Mechanism",
        "Outcome"
      ]
    },
    {
      "text": "Cause layer 3",
      "subtext": "Complex interactions emerging at the deepest layer.",
      "duration": 300,
      "visual": "lattice",
      "action": "dramatic_pull_back",
      "category": "EVERYDAY SYSTEMS",
      "accentColor": "#38bdf8",
      "palette": {
        "background": "#0f172a",
        "secondary": "#1e293b"
      },
      "assetTags": [
        "home",
        "cart",
        "transport",
        "people",
        "factory"
      ]
    },
    {
      "text": "Data lens",
      "subtext": "The numbers tell a distinctly different story.",
      "duration": 300,
      "visual": "neural_core",
      "action": "slow_pan_up",
      "category": "EVERYDAY SYSTEMS",
      "accentColor": "#38bdf8",
      "palette": {
        "background": "#0f172a",
        "secondary": "#1e293b"
      },
      "assetTags": [
        "home",
        "cart",
        "transport",
        "people",
        "factory"
      ]
    },
    {
      "text": "Real world scene",
      "subtext": "How this abstract model plays out on the ground.",
      "duration": 300,
      "visual": "city",
      "action": "pan_right",
      "category": "EVERYDAY SYSTEMS",
      "accentColor": "#38bdf8",
      "palette": {
        "background": "#0f172a",
        "secondary": "#1e293b"
      },
      "assetTags": [
        "home",
        "cart",
        "transport",
        "people",
        "factory"
      ]
    },
    {
      "text": "Ecology/externalities",
      "subtext": "Tracing the unintended environmental consequences.",
      "duration": 300,
      "visual": "animals",
      "action": "slow_zoom_in",
      "category": "EVERYDAY SYSTEMS",
      "accentColor": "#38bdf8",
      "palette": {
        "background": "#0f172a",
        "secondary": "#1e293b"
      },
      "assetTags": [
        "home",
        "cart",
        "transport",
        "people",
        "factory"
      ],
      "animals": [
        "bird",
        "fish",
        "bee"
      ]
    },
    {
      "text": "Macro trend",
      "subtext": "Zooming out to the planetary scale over the next decade.",
      "duration": 300,
      "visual": "earth",
      "action": "slow_pan_down",
      "category": "EVERYDAY SYSTEMS",
      "accentColor": "#38bdf8",
      "palette": {
        "background": "#0f172a",
        "secondary": "#1e293b"
      },
      "assetTags": [
        "home",
        "cart",
        "transport",
        "people",
        "factory"
      ]
    },
    {
      "text": "Actionable takeaway",
      "subtext": "Leveraging this architecture for positive outcomes.",
      "duration": 300,
      "visual": "icons",
      "action": "dramatic_pull_back",
      "category": "EVERYDAY SYSTEMS",
      "accentColor": "#38bdf8",
      "palette": {
        "background": "#0f172a",
        "secondary": "#1e293b"
      },
      "assetTags": [
        "home",
        "cart",
        "transport",
        "people",
        "factory"
      ],
      "icons": [
        "home",
        "cart",
        "transport",
        "bank",
        "factory",
        "home"
      ]
    },
    {
      "text": "Closing",
      "subtext": "Why Is Traffic Always Bad at the Same Time?, demystified and mapped.",
      "duration": 300,
      "visual": "crowd",
      "action": "slow_zoom_in",
      "category": "EVERYDAY SYSTEMS",
      "accentColor": "#38bdf8",
      "palette": {
        "background": "#0f172a",
        "secondary": "#1e293b"
      },
      "assetTags": [
        "home",
        "cart",
        "transport",
        "people",
        "factory"
      ],
      "crowdCount": 15,
      "mood": "happy"
    }
  ]
}
