{
  "id": "video_321",
  "title": "How Crisis Expands Government Power",
  "template": "explainer",
  "fps": 30,
  "width": 1080,
  "height": 1920,
  "category": "POWER & INSTITUTIONS",
  "accentColor": "#a78bfa",
  "scenes": [
    {
      "text": "How Crisis Expands Government Power",
      "subtext": "Deconstructing the invisible machinery.",
      "duration": 300,
      "visual": "crowd",
      "action": "slow_zoom_in",
      "category": "POWER & INSTITUTIONS",
      "accentColor": "#a78bfa",
      "palette": {
        "background": "#1e1b4b",
        "secondary": "#312e81"
      },
      "assetTags": [
        "law",
        "shield",
        "scale",
        "people",
        "book"
      ],
      "crowdCount": 11,
      "mood": "neutral"
    },
    {
      "text": "Hook",
      "subtext": "How the architecture of How Crisis Expands Government Power impacts your daily life.",
      "duration": 300,
      "visual": "icons",
      "action": "pan_right",
      "category": "POWER & INSTITUTIONS",
      "accentColor": "#a78bfa",
      "palette": {
        "background": "#1e1b4b",
        "secondary": "#312e81"
      },
      "assetTags": [
        "law",
        "shield",
        "scale",
        "people",
        "book"
      ],
      "weather": "rain",
      "icons": [
        "law",
        "shield",
        "scale",
        "bank",
        "factory",
        "home",
        "PropDeclarativeRobot",
        "PropServer",
        "PropDeclarativeSaturn"
      ]
    },
    {
      "text": "System boundary",
      "subtext": "Where does the jurisdiction of this system begin and end?",
      "duration": 300,
      "visual": "network",
      "action": "static_focus",
      "category": "POWER & INSTITUTIONS",
      "accentColor": "#a78bfa",
      "palette": {
        "background": "#1e1b4b",
        "secondary": "#312e81"
      },
      "assetTags": [
        "law",
        "shield",
        "scale",
        "people",
        "book"
      ],
      "backgroundMode": "mesh",
      "networkNodes": [
        "State",
        "Market",
        "Labor",
        "Capital",
        "Public"
      ]
    },
    {
      "text": "Cause layer 1",
      "subtext": "At its core, this is what fuels the entire process.",
      "duration": 300,
      "visual": "math_equation",
      "action": "slow_zoom_in",
      "category": "POWER & INSTITUTIONS",
      "accentColor": "#a78bfa",
      "palette": {
        "background": "#1e1b4b",
        "secondary": "#312e81"
      },
      "assetTags": [
        "law",
        "shield",
        "scale",
        "people",
        "book"
      ]
    },
    {
      "text": "Cause layer 2",
      "subtext": "How these mechanisms propagate through the network.",
      "duration": 300,
      "visual": "flow",
      "action": "pan_left",
      "category": "POWER & INSTITUTIONS",
      "accentColor": "#a78bfa",
      "palette": {
        "background": "#1e1b4b",
        "secondary": "#312e81"
      },
      "assetTags": [
        "law",
        "shield",
        "scale",
        "people",
        "book"
      ],
      "flowLabels": [
        "Trigger",
        "Mechanism",
        "Outcome"
      ]
    },
    {
      "text": "Cause layer 3",
      "subtext": "Complex interactions emerging at the deepest layer.",
      "duration": 300,
      "visual": "lattice",
      "action": "dramatic_pull_back",
      "category": "POWER & INSTITUTIONS",
      "accentColor": "#a78bfa",
      "palette": {
        "background": "#1e1b4b",
        "secondary": "#312e81"
      },
      "assetTags": [
        "law",
        "shield",
        "scale",
        "people",
        "book"
      ],
      "backgroundMode": "mesh",
      "weather": "rain"
    },
    {
      "text": "Data lens",
      "subtext": "Quantifying the impact through statistical analysis.",
      "duration": 300,
      "visual": "neural_core",
      "action": "slow_pan_up",
      "category": "POWER & INSTITUTIONS",
      "accentColor": "#a78bfa",
      "palette": {
        "background": "#1e1b4b",
        "secondary": "#312e81"
      },
      "assetTags": [
        "law",
        "shield",
        "scale",
        "people",
        "book"
      ]
    },
    {
      "text": "Real world scene",
      "subtext": "How policy translates into physical execution.",
      "duration": 300,
      "visual": "city",
      "action": "pan_right",
      "category": "POWER & INSTITUTIONS",
      "accentColor": "#a78bfa",
      "palette": {
        "background": "#1e1b4b",
        "secondary": "#312e81"
      },
      "assetTags": [
        "law",
        "shield",
        "scale",
        "people",
        "book"
      ]
    },
    {
      "text": "Ecology/externalities",
      "subtext": "What the frictionless model fails to account for.",
      "duration": 300,
      "visual": "animals",
      "action": "slow_zoom_in",
      "category": "POWER & INSTITUTIONS",
      "accentColor": "#a78bfa",
      "palette": {
        "background": "#1e1b4b",
        "secondary": "#312e81"
      },
      "assetTags": [
        "law",
        "shield",
        "scale",
        "people",
        "book"
      ],
      "animals": [
        "bird",
        "fish",
        "bee"
      ]
    },
    {
      "text": "Macro trend",
      "subtext": "Zooming out to the planetary scale over the next decade.",
      "duration": 300,
      "visual": "earth",
      "action": "slow_pan_down",
      "category": "POWER & INSTITUTIONS",
      "accentColor": "#a78bfa",
      "palette": {
        "background": "#1e1b4b",
        "secondary": "#312e81"
      },
      "assetTags": [
        "law",
        "shield",
        "scale",
        "people",
        "book"
      ],
      "backgroundMode": "terrain"
    },
    {
      "text": "Actionable takeaway",
      "subtext": "Leveraging this architecture for positive outcomes.",
      "duration": 300,
      "visual": "icons",
      "action": "dramatic_pull_back",
      "category": "POWER & INSTITUTIONS",
      "accentColor": "#a78bfa",
      "palette": {
        "background": "#1e1b4b",
        "secondary": "#312e81"
      },
      "assetTags": [
        "law",
        "shield",
        "scale",
        "people",
        "book"
      ],
      "icons": [
        "law",
        "shield",
        "scale",
        "bank",
        "factory",
        "home",
        "PropDeclarativeRobot",
        "PropServer",
        "PropDeclarativeSaturn"
      ]
    },
    {
      "text": "Closing",
      "subtext": "How Crisis Expands Government Power, demystified and mapped.",
      "duration": 300,
      "visual": "crowd",
      "action": "slow_zoom_in",
      "category": "POWER & INSTITUTIONS",
      "accentColor": "#a78bfa",
      "palette": {
        "background": "#1e1b4b",
        "secondary": "#312e81"
      },
      "assetTags": [
        "law",
        "shield",
        "scale",
        "people",
        "book"
      ],
      "crowdCount": 11,
      "mood": "happy"
    }
  ]
}
