{
  "id": "video_259",
  "title": "How Information Cascades Happen",
  "template": "protest",
  "fps": 30,
  "width": 1080,
  "height": 1920,
  "category": "INFORMATION SYSTEMS",
  "accentColor": "#f472b6",
  "scenes": [
    {
      "text": "How Information Cascades Happen",
      "subtext": "A deep dive into the underlying architecture.",
      "duration": 300,
      "visual": "crowd",
      "action": "slow_zoom_in",
      "category": "INFORMATION SYSTEMS",
      "accentColor": "#f472b6",
      "palette": {
        "background": "#1a0524",
        "secondary": "#3b0764"
      },
      "assetTags": [
        "media",
        "cloud",
        "ai",
        "network",
        "algorithm"
      ],
      "crowdCount": 13,
      "mood": "neutral"
    },
    {
      "text": "Hook",
      "subtext": "Why the mechanisms behind How Information Cascades Happen are reaching a breaking point.",
      "duration": 300,
      "visual": "icons",
      "action": "pan_right",
      "category": "INFORMATION SYSTEMS",
      "accentColor": "#f472b6",
      "palette": {
        "background": "#1a0524",
        "secondary": "#3b0764"
      },
      "assetTags": [
        "media",
        "cloud",
        "ai",
        "network",
        "algorithm"
      ],
      "weather": "rain",
      "icons": [
        "media",
        "cloud",
        "ai",
        "bank",
        "factory",
        "home",
        "PropDeclarativeRobot",
        "PropServer",
        "PropDeclarativeSaturn"
      ]
    },
    {
      "text": "System boundary",
      "subtext": "Where does the jurisdiction of this system begin and end?",
      "duration": 300,
      "visual": "network",
      "action": "static_focus",
      "category": "INFORMATION SYSTEMS",
      "accentColor": "#f472b6",
      "palette": {
        "background": "#1a0524",
        "secondary": "#3b0764"
      },
      "assetTags": [
        "media",
        "cloud",
        "ai",
        "network",
        "algorithm"
      ],
      "backgroundMode": "mesh",
      "networkNodes": [
        "State",
        "Market",
        "Labor",
        "Capital",
        "Public"
      ]
    },
    {
      "text": "Cause layer 1",
      "subtext": "At its core, this is what fuels the entire process.",
      "duration": 300,
      "visual": "math_equation",
      "action": "slow_zoom_in",
      "category": "INFORMATION SYSTEMS",
      "accentColor": "#f472b6",
      "palette": {
        "background": "#1a0524",
        "secondary": "#3b0764"
      },
      "assetTags": [
        "media",
        "cloud",
        "ai",
        "network",
        "algorithm"
      ]
    },
    {
      "text": "Cause layer 2",
      "subtext": "The secondary effects rippling outward.",
      "duration": 300,
      "visual": "flow",
      "action": "pan_left",
      "category": "INFORMATION SYSTEMS",
      "accentColor": "#f472b6",
      "palette": {
        "background": "#1a0524",
        "secondary": "#3b0764"
      },
      "assetTags": [
        "media",
        "cloud",
        "ai",
        "network",
        "algorithm"
      ],
      "flowLabels": [
        "Trigger",
        "Mechanism",
        "Outcome"
      ]
    },
    {
      "text": "Cause layer 3",
      "subtext": "The mathematical convergence of these variables.",
      "duration": 300,
      "visual": "lattice",
      "action": "dramatic_pull_back",
      "category": "INFORMATION SYSTEMS",
      "accentColor": "#f472b6",
      "palette": {
        "background": "#1a0524",
        "secondary": "#3b0764"
      },
      "assetTags": [
        "media",
        "cloud",
        "ai",
        "network",
        "algorithm"
      ],
      "backgroundMode": "mesh",
      "weather": "rain"
    },
    {
      "text": "Data lens",
      "subtext": "Quantifying the impact through statistical analysis.",
      "duration": 300,
      "visual": "neural_core",
      "action": "slow_pan_up",
      "category": "INFORMATION SYSTEMS",
      "accentColor": "#f472b6",
      "palette": {
        "background": "#1a0524",
        "secondary": "#3b0764"
      },
      "assetTags": [
        "media",
        "cloud",
        "ai",
        "network",
        "algorithm"
      ]
    },
    {
      "text": "Real world scene",
      "subtext": "How this abstract model plays out on the ground.",
      "duration": 300,
      "visual": "city",
      "action": "pan_right",
      "category": "INFORMATION SYSTEMS",
      "accentColor": "#f472b6",
      "palette": {
        "background": "#1a0524",
        "secondary": "#3b0764"
      },
      "assetTags": [
        "media",
        "cloud",
        "ai",
        "network",
        "algorithm"
      ]
    },
    {
      "text": "Ecology/externalities",
      "subtext": "What the frictionless model fails to account for.",
      "duration": 300,
      "visual": "animals",
      "action": "slow_zoom_in",
      "category": "INFORMATION SYSTEMS",
      "accentColor": "#f472b6",
      "palette": {
        "background": "#1a0524",
        "secondary": "#3b0764"
      },
      "assetTags": [
        "media",
        "cloud",
        "ai",
        "network",
        "algorithm"
      ],
      "animals": [
        "bird",
        "fish",
        "bee"
      ]
    },
    {
      "text": "Macro trend",
      "subtext": "Zooming out to the planetary scale over the next decade.",
      "duration": 300,
      "visual": "earth",
      "action": "slow_pan_down",
      "category": "INFORMATION SYSTEMS",
      "accentColor": "#f472b6",
      "palette": {
        "background": "#1a0524",
        "secondary": "#3b0764"
      },
      "assetTags": [
        "media",
        "cloud",
        "ai",
        "network",
        "algorithm"
      ],
      "backgroundMode": "terrain"
    },
    {
      "text": "Actionable takeaway",
      "subtext": "Leveraging this architecture for positive outcomes.",
      "duration": 300,
      "visual": "icons",
      "action": "dramatic_pull_back",
      "category": "INFORMATION SYSTEMS",
      "accentColor": "#f472b6",
      "palette": {
        "background": "#1a0524",
        "secondary": "#3b0764"
      },
      "assetTags": [
        "media",
        "cloud",
        "ai",
        "network",
        "algorithm"
      ],
      "icons": [
        "media",
        "cloud",
        "ai",
        "bank",
        "factory",
        "home",
        "PropDeclarativeRobot",
        "PropServer",
        "PropDeclarativeSaturn"
      ]
    },
    {
      "text": "Closing",
      "subtext": "Understanding the architecture of our reality.",
      "duration": 300,
      "visual": "crowd",
      "action": "slow_zoom_in",
      "category": "INFORMATION SYSTEMS",
      "accentColor": "#f472b6",
      "palette": {
        "background": "#1a0524",
        "secondary": "#3b0764"
      },
      "assetTags": [
        "media",
        "cloud",
        "ai",
        "network",
        "algorithm"
      ],
      "crowdCount": 13,
      "mood": "happy"
    }
  ]
}
