{
  "id": "video_287",
  "title": "How Algorithm Updates Shift Behavior",
  "template": "protest",
  "fps": 30,
  "width": 1080,
  "height": 1920,
  "category": "INFORMATION SYSTEMS",
  "accentColor": "#f472b6",
  "scenes": [
    {
      "text": "How Algorithm Updates Shift Behavior",
      "subtext": "How How Algorithm Updates Shift Behavior actually functions.",
      "duration": 300,
      "visual": "crowd",
      "action": "slow_zoom_in",
      "category": "INFORMATION SYSTEMS",
      "accentColor": "#f472b6",
      "palette": {
        "background": "#1a0524",
        "secondary": "#3b0764"
      },
      "assetTags": [
        "media",
        "cloud",
        "ai",
        "network",
        "algorithm"
      ],
      "crowdCount": 17,
      "mood": "neutral"
    },
    {
      "text": "Hook",
      "subtext": "Why the mechanisms behind How Algorithm Updates Shift Behavior are reaching a breaking point.",
      "duration": 300,
      "visual": "icons",
      "action": "pan_right",
      "category": "INFORMATION SYSTEMS",
      "accentColor": "#f472b6",
      "palette": {
        "background": "#1a0524",
        "secondary": "#3b0764"
      },
      "assetTags": [
        "media",
        "cloud",
        "ai",
        "network",
        "algorithm"
      ],
      "icons": [
        "media",
        "cloud",
        "ai",
        "bank",
        "factory",
        "home"
      ]
    },
    {
      "text": "System boundary",
      "subtext": "Mapping the outer limits of the network.",
      "duration": 300,
      "visual": "network",
      "action": "static_focus",
      "category": "INFORMATION SYSTEMS",
      "accentColor": "#f472b6",
      "palette": {
        "background": "#1a0524",
        "secondary": "#3b0764"
      },
      "assetTags": [
        "media",
        "cloud",
        "ai",
        "network",
        "algorithm"
      ],
      "networkNodes": [
        "State",
        "Market",
        "Labor",
        "Capital",
        "Public"
      ]
    },
    {
      "text": "Cause layer 1",
      "subtext": "The foundational layer holding the structure together.",
      "duration": 300,
      "visual": "math_equation",
      "action": "slow_zoom_in",
      "category": "INFORMATION SYSTEMS",
      "accentColor": "#f472b6",
      "palette": {
        "background": "#1a0524",
        "secondary": "#3b0764"
      },
      "assetTags": [
        "media",
        "cloud",
        "ai",
        "network",
        "algorithm"
      ]
    },
    {
      "text": "Cause layer 2",
      "subtext": "Tracing the flow of cause and effect.",
      "duration": 300,
      "visual": "flow",
      "action": "pan_left",
      "category": "INFORMATION SYSTEMS",
      "accentColor": "#f472b6",
      "palette": {
        "background": "#1a0524",
        "secondary": "#3b0764"
      },
      "assetTags": [
        "media",
        "cloud",
        "ai",
        "network",
        "algorithm"
      ],
      "flowLabels": [
        "Trigger",
        "Mechanism",
        "Outcome"
      ]
    },
    {
      "text": "Cause layer 3",
      "subtext": "Complex interactions emerging at the deepest layer.",
      "duration": 300,
      "visual": "lattice",
      "action": "dramatic_pull_back",
      "category": "INFORMATION SYSTEMS",
      "accentColor": "#f472b6",
      "palette": {
        "background": "#1a0524",
        "secondary": "#3b0764"
      },
      "assetTags": [
        "media",
        "cloud",
        "ai",
        "network",
        "algorithm"
      ]
    },
    {
      "text": "Data lens",
      "subtext": "What the raw metrics reveal about How Algorithm Updates Shift Behavior.",
      "duration": 300,
      "visual": "neural_core",
      "action": "slow_pan_up",
      "category": "INFORMATION SYSTEMS",
      "accentColor": "#f472b6",
      "palette": {
        "background": "#1a0524",
        "secondary": "#3b0764"
      },
      "assetTags": [
        "media",
        "cloud",
        "ai",
        "network",
        "algorithm"
      ]
    },
    {
      "text": "Real world scene",
      "subtext": "How this abstract model plays out on the ground.",
      "duration": 300,
      "visual": "city",
      "action": "pan_right",
      "category": "INFORMATION SYSTEMS",
      "accentColor": "#f472b6",
      "palette": {
        "background": "#1a0524",
        "secondary": "#3b0764"
      },
      "assetTags": [
        "media",
        "cloud",
        "ai",
        "network",
        "algorithm"
      ]
    },
    {
      "text": "Ecology/externalities",
      "subtext": "The hidden costs externalized by the system.",
      "duration": 300,
      "visual": "animals",
      "action": "slow_zoom_in",
      "category": "INFORMATION SYSTEMS",
      "accentColor": "#f472b6",
      "palette": {
        "background": "#1a0524",
        "secondary": "#3b0764"
      },
      "assetTags": [
        "media",
        "cloud",
        "ai",
        "network",
        "algorithm"
      ],
      "animals": [
        "bird",
        "fish",
        "bee"
      ]
    },
    {
      "text": "Macro trend",
      "subtext": "The inevitable mathematical conclusion on a macro level.",
      "duration": 300,
      "visual": "earth",
      "action": "slow_pan_down",
      "category": "INFORMATION SYSTEMS",
      "accentColor": "#f472b6",
      "palette": {
        "background": "#1a0524",
        "secondary": "#3b0764"
      },
      "assetTags": [
        "media",
        "cloud",
        "ai",
        "network",
        "algorithm"
      ]
    },
    {
      "text": "Actionable takeaway",
      "subtext": "Leveraging this architecture for positive outcomes.",
      "duration": 300,
      "visual": "icons",
      "action": "dramatic_pull_back",
      "category": "INFORMATION SYSTEMS",
      "accentColor": "#f472b6",
      "palette": {
        "background": "#1a0524",
        "secondary": "#3b0764"
      },
      "assetTags": [
        "media",
        "cloud",
        "ai",
        "network",
        "algorithm"
      ],
      "icons": [
        "media",
        "cloud",
        "ai",
        "bank",
        "factory",
        "home"
      ]
    },
    {
      "text": "Closing",
      "subtext": "Understanding the architecture of our reality.",
      "duration": 300,
      "visual": "crowd",
      "action": "slow_zoom_in",
      "category": "INFORMATION SYSTEMS",
      "accentColor": "#f472b6",
      "palette": {
        "background": "#1a0524",
        "secondary": "#3b0764"
      },
      "assetTags": [
        "media",
        "cloud",
        "ai",
        "network",
        "algorithm"
      ],
      "crowdCount": 17,
      "mood": "happy"
    }
  ]
}
