{
  "id": "video_050",
  "title": "Why Do We Feel Replaceable at Work?",
  "template": "protest",
  "fps": 30,
  "width": 1080,
  "height": 1920,
  "category": "EVERYDAY SYSTEMS",
  "accentColor": "#38bdf8",
  "scenes": [
    {
      "text": "Why Do We Feel Replaceable at Work?",
      "subtext": "Deconstructing the invisible machinery.",
      "duration": 300,
      "visual": "crowd",
      "action": "slow_zoom_in",
      "category": "EVERYDAY SYSTEMS",
      "accentColor": "#38bdf8",
      "palette": {
        "background": "#0f172a",
        "secondary": "#1e293b"
      },
      "assetTags": [
        "home",
        "cart",
        "transport",
        "people",
        "factory"
      ],
      "crowdCount": 12,
      "mood": "neutral"
    },
    {
      "text": "Hook",
      "subtext": "The critical vulnerabilities hidden within Why Do We Feel Replaceable at Work?.",
      "duration": 300,
      "visual": "icons",
      "action": "pan_right",
      "category": "EVERYDAY SYSTEMS",
      "accentColor": "#38bdf8",
      "palette": {
        "background": "#0f172a",
        "secondary": "#1e293b"
      },
      "assetTags": [
        "home",
        "cart",
        "transport",
        "people",
        "factory"
      ],
      "icons": [
        "home",
        "cart",
        "transport",
        "bank",
        "factory",
        "home"
      ]
    },
    {
      "text": "System boundary",
      "subtext": "Mapping the outer limits of the network.",
      "duration": 300,
      "visual": "network",
      "action": "static_focus",
      "category": "EVERYDAY SYSTEMS",
      "accentColor": "#38bdf8",
      "palette": {
        "background": "#0f172a",
        "secondary": "#1e293b"
      },
      "assetTags": [
        "home",
        "cart",
        "transport",
        "people",
        "factory"
      ],
      "networkNodes": [
        "State",
        "Market",
        "Labor",
        "Capital",
        "Public"
      ]
    },
    {
      "text": "Cause layer 1",
      "subtext": "The foundational layer holding the structure together.",
      "duration": 300,
      "visual": "math_equation",
      "action": "slow_zoom_in",
      "category": "EVERYDAY SYSTEMS",
      "accentColor": "#38bdf8",
      "palette": {
        "background": "#0f172a",
        "secondary": "#1e293b"
      },
      "assetTags": [
        "home",
        "cart",
        "transport",
        "people",
        "factory"
      ]
    },
    {
      "text": "Cause layer 2",
      "subtext": "The secondary effects rippling outward.",
      "duration": 300,
      "visual": "flow",
      "action": "pan_left",
      "category": "EVERYDAY SYSTEMS",
      "accentColor": "#38bdf8",
      "palette": {
        "background": "#0f172a",
        "secondary": "#1e293b"
      },
      "assetTags": [
        "home",
        "cart",
        "transport",
        "people",
        "factory"
      ],
      "flowLabels": [
        "Trigger",
        "Mechanism",
        "Outcome"
      ]
    },
    {
      "text": "Cause layer 3",
      "subtext": "Feedback loops that exponentially amplify or dampen the baseline.",
      "duration": 300,
      "visual": "lattice",
      "action": "dramatic_pull_back",
      "category": "EVERYDAY SYSTEMS",
      "accentColor": "#38bdf8",
      "palette": {
        "background": "#0f172a",
        "secondary": "#1e293b"
      },
      "assetTags": [
        "home",
        "cart",
        "transport",
        "people",
        "factory"
      ]
    },
    {
      "text": "Data lens",
      "subtext": "What the raw metrics reveal about Why Do We Feel Replaceable at Work?.",
      "duration": 300,
      "visual": "neural_core",
      "action": "slow_pan_up",
      "category": "EVERYDAY SYSTEMS",
      "accentColor": "#38bdf8",
      "palette": {
        "background": "#0f172a",
        "secondary": "#1e293b"
      },
      "assetTags": [
        "home",
        "cart",
        "transport",
        "people",
        "factory"
      ]
    },
    {
      "text": "Real world scene",
      "subtext": "How this abstract model plays out on the ground.",
      "duration": 300,
      "visual": "city",
      "action": "pan_right",
      "category": "EVERYDAY SYSTEMS",
      "accentColor": "#38bdf8",
      "palette": {
        "background": "#0f172a",
        "secondary": "#1e293b"
      },
      "assetTags": [
        "home",
        "cart",
        "transport",
        "people",
        "factory"
      ]
    },
    {
      "text": "Ecology/externalities",
      "subtext": "What the frictionless model fails to account for.",
      "duration": 300,
      "visual": "animals",
      "action": "slow_zoom_in",
      "category": "EVERYDAY SYSTEMS",
      "accentColor": "#38bdf8",
      "palette": {
        "background": "#0f172a",
        "secondary": "#1e293b"
      },
      "assetTags": [
        "home",
        "cart",
        "transport",
        "people",
        "factory"
      ],
      "animals": [
        "bird",
        "fish",
        "bee"
      ]
    },
    {
      "text": "Macro trend",
      "subtext": "Where this trajectory implies we are headed next.",
      "duration": 300,
      "visual": "earth",
      "action": "slow_pan_down",
      "category": "EVERYDAY SYSTEMS",
      "accentColor": "#38bdf8",
      "palette": {
        "background": "#0f172a",
        "secondary": "#1e293b"
      },
      "assetTags": [
        "home",
        "cart",
        "transport",
        "people",
        "factory"
      ]
    },
    {
      "text": "Actionable takeaway",
      "subtext": "Leveraging this architecture for positive outcomes.",
      "duration": 300,
      "visual": "icons",
      "action": "dramatic_pull_back",
      "category": "EVERYDAY SYSTEMS",
      "accentColor": "#38bdf8",
      "palette": {
        "background": "#0f172a",
        "secondary": "#1e293b"
      },
      "assetTags": [
        "home",
        "cart",
        "transport",
        "people",
        "factory"
      ],
      "icons": [
        "home",
        "cart",
        "transport",
        "bank",
        "factory",
        "home"
      ]
    },
    {
      "text": "Closing",
      "subtext": "Understanding the architecture of our reality.",
      "duration": 300,
      "visual": "crowd",
      "action": "slow_zoom_in",
      "category": "EVERYDAY SYSTEMS",
      "accentColor": "#38bdf8",
      "palette": {
        "background": "#0f172a",
        "secondary": "#1e293b"
      },
      "assetTags": [
        "home",
        "cart",
        "transport",
        "people",
        "factory"
      ],
      "crowdCount": 12,
      "mood": "happy"
    }
  ]
}
