{
  "id": "video_406",
  "title": "What Creates Tipping Points",
  "template": "protest",
  "fps": 30,
  "width": 1080,
  "height": 1920,
  "category": "FUTURE SYSTEMS",
  "accentColor": "#14b8a6",
  "scenes": [
    {
      "text": "What Creates Tipping Points",
      "subtext": "How What Creates Tipping Points actually functions.",
      "duration": 300,
      "visual": "crowd",
      "action": "slow_zoom_in",
      "category": "FUTURE SYSTEMS",
      "accentColor": "#14b8a6",
      "palette": {
        "background": "#042f2e",
        "secondary": "#134e4a"
      },
      "assetTags": [
        "ai",
        "gear",
        "lightning",
        "globe",
        "wave"
      ],
      "backgroundMode": "terrain",
      "crowdCount": 16,
      "mood": "neutral"
    },
    {
      "text": "Hook",
      "subtext": "The critical vulnerabilities hidden within What Creates Tipping Points.",
      "duration": 300,
      "visual": "icons",
      "action": "pan_right",
      "category": "FUTURE SYSTEMS",
      "accentColor": "#14b8a6",
      "palette": {
        "background": "#042f2e",
        "secondary": "#134e4a"
      },
      "assetTags": [
        "ai",
        "gear",
        "lightning",
        "globe",
        "wave"
      ],
      "backgroundMode": "terrain",
      "weather": "rain",
      "icons": [
        "ai",
        "gear",
        "lightning",
        "bank",
        "factory",
        "home",
        "PropDeclarativeRobot",
        "PropServer",
        "PropDeclarativeSaturn"
      ]
    },
    {
      "text": "System boundary",
      "subtext": "Mapping the outer limits of the network.",
      "duration": 300,
      "visual": "network",
      "action": "static_focus",
      "category": "FUTURE SYSTEMS",
      "accentColor": "#14b8a6",
      "palette": {
        "background": "#042f2e",
        "secondary": "#134e4a"
      },
      "assetTags": [
        "ai",
        "gear",
        "lightning",
        "globe",
        "wave"
      ],
      "backgroundMode": "terrain",
      "networkNodes": [
        "State",
        "Market",
        "Labor",
        "Capital",
        "Public"
      ]
    },
    {
      "text": "Cause layer 1",
      "subtext": "The foundational layer holding the structure together.",
      "duration": 300,
      "visual": "math_equation",
      "action": "slow_zoom_in",
      "category": "FUTURE SYSTEMS",
      "accentColor": "#14b8a6",
      "palette": {
        "background": "#042f2e",
        "secondary": "#134e4a"
      },
      "assetTags": [
        "ai",
        "gear",
        "lightning",
        "globe",
        "wave"
      ],
      "backgroundMode": "terrain"
    },
    {
      "text": "Cause layer 2",
      "subtext": "The secondary effects rippling outward.",
      "duration": 300,
      "visual": "flow",
      "action": "pan_left",
      "category": "FUTURE SYSTEMS",
      "accentColor": "#14b8a6",
      "palette": {
        "background": "#042f2e",
        "secondary": "#134e4a"
      },
      "assetTags": [
        "ai",
        "gear",
        "lightning",
        "globe",
        "wave"
      ],
      "backgroundMode": "terrain",
      "flowLabels": [
        "Trigger",
        "Mechanism",
        "Outcome"
      ]
    },
    {
      "text": "Cause layer 3",
      "subtext": "The mathematical convergence of these variables.",
      "duration": 300,
      "visual": "lattice",
      "action": "dramatic_pull_back",
      "category": "FUTURE SYSTEMS",
      "accentColor": "#14b8a6",
      "palette": {
        "background": "#042f2e",
        "secondary": "#134e4a"
      },
      "assetTags": [
        "ai",
        "gear",
        "lightning",
        "globe",
        "wave"
      ],
      "backgroundMode": "terrain",
      "weather": "rain"
    },
    {
      "text": "Data lens",
      "subtext": "Quantifying the impact through statistical analysis.",
      "duration": 300,
      "visual": "neural_core",
      "action": "slow_pan_up",
      "category": "FUTURE SYSTEMS",
      "accentColor": "#14b8a6",
      "palette": {
        "background": "#042f2e",
        "secondary": "#134e4a"
      },
      "assetTags": [
        "ai",
        "gear",
        "lightning",
        "globe",
        "wave"
      ],
      "backgroundMode": "terrain"
    },
    {
      "text": "Real world scene",
      "subtext": "How this abstract model plays out on the ground.",
      "duration": 300,
      "visual": "city",
      "action": "pan_right",
      "category": "FUTURE SYSTEMS",
      "accentColor": "#14b8a6",
      "palette": {
        "background": "#042f2e",
        "secondary": "#134e4a"
      },
      "assetTags": [
        "ai",
        "gear",
        "lightning",
        "globe",
        "wave"
      ],
      "backgroundMode": "terrain"
    },
    {
      "text": "Ecology/externalities",
      "subtext": "Tracing the unintended environmental consequences.",
      "duration": 300,
      "visual": "animals",
      "action": "slow_zoom_in",
      "category": "FUTURE SYSTEMS",
      "accentColor": "#14b8a6",
      "palette": {
        "background": "#042f2e",
        "secondary": "#134e4a"
      },
      "assetTags": [
        "ai",
        "gear",
        "lightning",
        "globe",
        "wave"
      ],
      "backgroundMode": "terrain",
      "animals": [
        "bird",
        "turtle",
        "deer"
      ]
    },
    {
      "text": "Macro trend",
      "subtext": "The inevitable mathematical conclusion on a macro level.",
      "duration": 300,
      "visual": "earth",
      "action": "slow_pan_down",
      "category": "FUTURE SYSTEMS",
      "accentColor": "#14b8a6",
      "palette": {
        "background": "#042f2e",
        "secondary": "#134e4a"
      },
      "assetTags": [
        "ai",
        "gear",
        "lightning",
        "globe",
        "wave"
      ],
      "backgroundMode": "terrain"
    },
    {
      "text": "Actionable takeaway",
      "subtext": "Leveraging this architecture for positive outcomes.",
      "duration": 300,
      "visual": "icons",
      "action": "dramatic_pull_back",
      "category": "FUTURE SYSTEMS",
      "accentColor": "#14b8a6",
      "palette": {
        "background": "#042f2e",
        "secondary": "#134e4a"
      },
      "assetTags": [
        "ai",
        "gear",
        "lightning",
        "globe",
        "wave"
      ],
      "backgroundMode": "terrain",
      "icons": [
        "ai",
        "gear",
        "lightning",
        "bank",
        "factory",
        "home",
        "PropDeclarativeRobot",
        "PropServer",
        "PropDeclarativeSaturn"
      ]
    },
    {
      "text": "Closing",
      "subtext": "What Creates Tipping Points, demystified and mapped.",
      "duration": 300,
      "visual": "crowd",
      "action": "slow_zoom_in",
      "category": "FUTURE SYSTEMS",
      "accentColor": "#14b8a6",
      "palette": {
        "background": "#042f2e",
        "secondary": "#134e4a"
      },
      "assetTags": [
        "ai",
        "gear",
        "lightning",
        "globe",
        "wave"
      ],
      "backgroundMode": "terrain",
      "crowdCount": 16,
      "mood": "happy"
    }
  ]
}
