{
  "id": "video_106",
  "title": "Why Currency Loses Value",
  "template": "protest",
  "fps": 30,
  "width": 1080,
  "height": 1920,
  "category": "MONEY & ECONOMICS",
  "accentColor": "#22c55e",
  "scenes": [
    {
      "text": "Why Currency Loses Value",
      "subtext": "How Why Currency Loses Value actually functions.",
      "duration": 300,
      "visual": "crowd",
      "action": "slow_zoom_in",
      "category": "MONEY & ECONOMICS",
      "accentColor": "#22c55e",
      "palette": {
        "background": "#052e16",
        "secondary": "#14532d"
      },
      "assetTags": [
        "bank",
        "coin",
        "chart",
        "factory",
        "globe"
      ],
      "crowdCount": 12,
      "mood": "neutral"
    },
    {
      "text": "Hook",
      "subtext": "How the architecture of Why Currency Loses Value impacts your daily life.",
      "duration": 300,
      "visual": "icons",
      "action": "pan_right",
      "category": "MONEY & ECONOMICS",
      "accentColor": "#22c55e",
      "palette": {
        "background": "#052e16",
        "secondary": "#14532d"
      },
      "assetTags": [
        "bank",
        "coin",
        "chart",
        "factory",
        "globe"
      ],
      "icons": [
        "bank",
        "coin",
        "chart",
        "bank",
        "factory",
        "home"
      ]
    },
    {
      "text": "System boundary",
      "subtext": "Where does the jurisdiction of this system begin and end?",
      "duration": 300,
      "visual": "network",
      "action": "static_focus",
      "category": "MONEY & ECONOMICS",
      "accentColor": "#22c55e",
      "palette": {
        "background": "#052e16",
        "secondary": "#14532d"
      },
      "assetTags": [
        "bank",
        "coin",
        "chart",
        "factory",
        "globe"
      ],
      "networkNodes": [
        "State",
        "Market",
        "Labor",
        "Capital",
        "Public"
      ]
    },
    {
      "text": "Cause layer 1",
      "subtext": "At its core, this is what fuels the entire process.",
      "duration": 300,
      "visual": "math_equation",
      "action": "slow_zoom_in",
      "category": "MONEY & ECONOMICS",
      "accentColor": "#22c55e",
      "palette": {
        "background": "#052e16",
        "secondary": "#14532d"
      },
      "assetTags": [
        "bank",
        "coin",
        "chart",
        "factory",
        "globe"
      ]
    },
    {
      "text": "Cause layer 2",
      "subtext": "How these mechanisms propagate through the network.",
      "duration": 300,
      "visual": "flow",
      "action": "pan_left",
      "category": "MONEY & ECONOMICS",
      "accentColor": "#22c55e",
      "palette": {
        "background": "#052e16",
        "secondary": "#14532d"
      },
      "assetTags": [
        "bank",
        "coin",
        "chart",
        "factory",
        "globe"
      ],
      "flowLabels": [
        "Trigger",
        "Mechanism",
        "Outcome"
      ]
    },
    {
      "text": "Cause layer 3",
      "subtext": "The mathematical convergence of these variables.",
      "duration": 300,
      "visual": "lattice",
      "action": "dramatic_pull_back",
      "category": "MONEY & ECONOMICS",
      "accentColor": "#22c55e",
      "palette": {
        "background": "#052e16",
        "secondary": "#14532d"
      },
      "assetTags": [
        "bank",
        "coin",
        "chart",
        "factory",
        "globe"
      ]
    },
    {
      "text": "Data lens",
      "subtext": "What the raw metrics reveal about Why Currency Loses Value.",
      "duration": 300,
      "visual": "neural_core",
      "action": "slow_pan_up",
      "category": "MONEY & ECONOMICS",
      "accentColor": "#22c55e",
      "palette": {
        "background": "#052e16",
        "secondary": "#14532d"
      },
      "assetTags": [
        "bank",
        "coin",
        "chart",
        "factory",
        "globe"
      ]
    },
    {
      "text": "Real world scene",
      "subtext": "How this institutional flow dictates market realities.",
      "duration": 300,
      "visual": "city",
      "action": "pan_right",
      "category": "MONEY & ECONOMICS",
      "accentColor": "#22c55e",
      "palette": {
        "background": "#052e16",
        "secondary": "#14532d"
      },
      "assetTags": [
        "bank",
        "coin",
        "chart",
        "factory",
        "globe"
      ]
    },
    {
      "text": "Ecology/externalities",
      "subtext": "Tracing the unintended environmental consequences.",
      "duration": 300,
      "visual": "animals",
      "action": "slow_zoom_in",
      "category": "MONEY & ECONOMICS",
      "accentColor": "#22c55e",
      "palette": {
        "background": "#052e16",
        "secondary": "#14532d"
      },
      "assetTags": [
        "bank",
        "coin",
        "chart",
        "factory",
        "globe"
      ],
      "animals": [
        "bird",
        "fish",
        "bee"
      ]
    },
    {
      "text": "Macro trend",
      "subtext": "The inevitable mathematical conclusion on a macro level.",
      "duration": 300,
      "visual": "earth",
      "action": "slow_pan_down",
      "category": "MONEY & ECONOMICS",
      "accentColor": "#22c55e",
      "palette": {
        "background": "#052e16",
        "secondary": "#14532d"
      },
      "assetTags": [
        "bank",
        "coin",
        "chart",
        "factory",
        "globe"
      ]
    },
    {
      "text": "Actionable takeaway",
      "subtext": "Leveraging this architecture for positive outcomes.",
      "duration": 300,
      "visual": "icons",
      "action": "dramatic_pull_back",
      "category": "MONEY & ECONOMICS",
      "accentColor": "#22c55e",
      "palette": {
        "background": "#052e16",
        "secondary": "#14532d"
      },
      "assetTags": [
        "bank",
        "coin",
        "chart",
        "factory",
        "globe"
      ],
      "icons": [
        "bank",
        "coin",
        "chart",
        "bank",
        "factory",
        "home"
      ]
    },
    {
      "text": "Closing",
      "subtext": "Understanding the architecture of our reality.",
      "duration": 300,
      "visual": "crowd",
      "action": "slow_zoom_in",
      "category": "MONEY & ECONOMICS",
      "accentColor": "#22c55e",
      "palette": {
        "background": "#052e16",
        "secondary": "#14532d"
      },
      "assetTags": [
        "bank",
        "coin",
        "chart",
        "factory",
        "globe"
      ],
      "crowdCount": 12,
      "mood": "happy"
    }
  ]
}
