{
  "id": "video_234",
  "title": "Why Trending Topics Feel Coordinated",
  "template": "explainer",
  "fps": 30,
  "width": 1080,
  "height": 1920,
  "category": "INFORMATION SYSTEMS",
  "accentColor": "#f472b6",
  "scenes": [
    {
      "text": "Why Trending Topics Feel Coordinated",
      "subtext": "A deep dive into the underlying architecture.",
      "duration": 300,
      "visual": "crowd",
      "action": "slow_zoom_in",
      "category": "INFORMATION SYSTEMS",
      "accentColor": "#f472b6",
      "palette": {
        "background": "#1a0524",
        "secondary": "#3b0764"
      },
      "assetTags": [
        "media",
        "cloud",
        "ai",
        "network",
        "algorithm"
      ],
      "crowdCount": 12,
      "mood": "neutral"
    },
    {
      "text": "Hook",
      "subtext": "Why the mechanisms behind Why Trending Topics Feel Coordinated are reaching a breaking point.",
      "duration": 300,
      "visual": "icons",
      "action": "pan_right",
      "category": "INFORMATION SYSTEMS",
      "accentColor": "#f472b6",
      "palette": {
        "background": "#1a0524",
        "secondary": "#3b0764"
      },
      "assetTags": [
        "media",
        "cloud",
        "ai",
        "network",
        "algorithm"
      ],
      "weather": "rain",
      "icons": [
        "media",
        "cloud",
        "ai",
        "bank",
        "factory",
        "home",
        "PropDeclarativeRobot",
        "PropServer",
        "PropDeclarativeSaturn"
      ]
    },
    {
      "text": "System boundary",
      "subtext": "Mapping the outer limits of the network.",
      "duration": 300,
      "visual": "network",
      "action": "static_focus",
      "category": "INFORMATION SYSTEMS",
      "accentColor": "#f472b6",
      "palette": {
        "background": "#1a0524",
        "secondary": "#3b0764"
      },
      "assetTags": [
        "media",
        "cloud",
        "ai",
        "network",
        "algorithm"
      ],
      "backgroundMode": "mesh",
      "networkNodes": [
        "State",
        "Market",
        "Labor",
        "Capital",
        "Public"
      ]
    },
    {
      "text": "Cause layer 1",
      "subtext": "At its core, this is what fuels the entire process.",
      "duration": 300,
      "visual": "math_equation",
      "action": "slow_zoom_in",
      "category": "INFORMATION SYSTEMS",
      "accentColor": "#f472b6",
      "palette": {
        "background": "#1a0524",
        "secondary": "#3b0764"
      },
      "assetTags": [
        "media",
        "cloud",
        "ai",
        "network",
        "algorithm"
      ]
    },
    {
      "text": "Cause layer 2",
      "subtext": "How these mechanisms propagate through the network.",
      "duration": 300,
      "visual": "flow",
      "action": "pan_left",
      "category": "INFORMATION SYSTEMS",
      "accentColor": "#f472b6",
      "palette": {
        "background": "#1a0524",
        "secondary": "#3b0764"
      },
      "assetTags": [
        "media",
        "cloud",
        "ai",
        "network",
        "algorithm"
      ],
      "flowLabels": [
        "Trigger",
        "Mechanism",
        "Outcome"
      ]
    },
    {
      "text": "Cause layer 3",
      "subtext": "Complex interactions emerging at the deepest layer.",
      "duration": 300,
      "visual": "lattice",
      "action": "dramatic_pull_back",
      "category": "INFORMATION SYSTEMS",
      "accentColor": "#f472b6",
      "palette": {
        "background": "#1a0524",
        "secondary": "#3b0764"
      },
      "assetTags": [
        "media",
        "cloud",
        "ai",
        "network",
        "algorithm"
      ],
      "backgroundMode": "mesh",
      "weather": "rain"
    },
    {
      "text": "Data lens",
      "subtext": "What the raw metrics reveal about Why Trending Topics Feel Coordinated.",
      "duration": 300,
      "visual": "neural_core",
      "action": "slow_pan_up",
      "category": "INFORMATION SYSTEMS",
      "accentColor": "#f472b6",
      "palette": {
        "background": "#1a0524",
        "secondary": "#3b0764"
      },
      "assetTags": [
        "media",
        "cloud",
        "ai",
        "network",
        "algorithm"
      ]
    },
    {
      "text": "Real world scene",
      "subtext": "How this abstract model plays out on the ground.",
      "duration": 300,
      "visual": "city",
      "action": "pan_right",
      "category": "INFORMATION SYSTEMS",
      "accentColor": "#f472b6",
      "palette": {
        "background": "#1a0524",
        "secondary": "#3b0764"
      },
      "assetTags": [
        "media",
        "cloud",
        "ai",
        "network",
        "algorithm"
      ]
    },
    {
      "text": "Ecology/externalities",
      "subtext": "The hidden costs externalized by the system.",
      "duration": 300,
      "visual": "animals",
      "action": "slow_zoom_in",
      "category": "INFORMATION SYSTEMS",
      "accentColor": "#f472b6",
      "palette": {
        "background": "#1a0524",
        "secondary": "#3b0764"
      },
      "assetTags": [
        "media",
        "cloud",
        "ai",
        "network",
        "algorithm"
      ],
      "animals": [
        "bird",
        "fish",
        "bee"
      ]
    },
    {
      "text": "Macro trend",
      "subtext": "Zooming out to the planetary scale over the next decade.",
      "duration": 300,
      "visual": "earth",
      "action": "slow_pan_down",
      "category": "INFORMATION SYSTEMS",
      "accentColor": "#f472b6",
      "palette": {
        "background": "#1a0524",
        "secondary": "#3b0764"
      },
      "assetTags": [
        "media",
        "cloud",
        "ai",
        "network",
        "algorithm"
      ],
      "backgroundMode": "terrain"
    },
    {
      "text": "Actionable takeaway",
      "subtext": "Leveraging this architecture for positive outcomes.",
      "duration": 300,
      "visual": "icons",
      "action": "dramatic_pull_back",
      "category": "INFORMATION SYSTEMS",
      "accentColor": "#f472b6",
      "palette": {
        "background": "#1a0524",
        "secondary": "#3b0764"
      },
      "assetTags": [
        "media",
        "cloud",
        "ai",
        "network",
        "algorithm"
      ],
      "icons": [
        "media",
        "cloud",
        "ai",
        "bank",
        "factory",
        "home",
        "PropDeclarativeRobot",
        "PropServer",
        "PropDeclarativeSaturn"
      ]
    },
    {
      "text": "Closing",
      "subtext": "Why Trending Topics Feel Coordinated, demystified and mapped.",
      "duration": 300,
      "visual": "crowd",
      "action": "slow_zoom_in",
      "category": "INFORMATION SYSTEMS",
      "accentColor": "#f472b6",
      "palette": {
        "background": "#1a0524",
        "secondary": "#3b0764"
      },
      "assetTags": [
        "media",
        "cloud",
        "ai",
        "network",
        "algorithm"
      ],
      "crowdCount": 12,
      "mood": "happy"
    }
  ]
}
