{
  "id": "video_176",
  "title": "Why Currency Wars Happen",
  "template": "protest",
  "fps": 30,
  "width": 1080,
  "height": 1920,
  "category": "MONEY & ECONOMICS",
  "accentColor": "#22c55e",
  "scenes": [
    {
      "text": "Why Currency Wars Happen",
      "subtext": "A deep dive into the underlying architecture.",
      "duration": 300,
      "visual": "crowd",
      "action": "slow_zoom_in",
      "category": "MONEY & ECONOMICS",
      "accentColor": "#22c55e",
      "palette": {
        "background": "#052e16",
        "secondary": "#14532d"
      },
      "assetTags": [
        "bank",
        "coin",
        "chart",
        "factory",
        "globe"
      ],
      "crowdCount": 10,
      "mood": "neutral"
    },
    {
      "text": "Hook",
      "subtext": "How the architecture of Why Currency Wars Happen impacts your daily life.",
      "duration": 300,
      "visual": "icons",
      "action": "pan_right",
      "category": "MONEY & ECONOMICS",
      "accentColor": "#22c55e",
      "palette": {
        "background": "#052e16",
        "secondary": "#14532d"
      },
      "assetTags": [
        "bank",
        "coin",
        "chart",
        "factory",
        "globe"
      ],
      "weather": "rain",
      "icons": [
        "bank",
        "coin",
        "chart",
        "bank",
        "factory",
        "home",
        "PropDeclarativeRobot",
        "PropServer",
        "PropDeclarativeSaturn"
      ]
    },
    {
      "text": "System boundary",
      "subtext": "Defining the strict boundaries of the architecture.",
      "duration": 300,
      "visual": "network",
      "action": "static_focus",
      "category": "MONEY & ECONOMICS",
      "accentColor": "#22c55e",
      "palette": {
        "background": "#052e16",
        "secondary": "#14532d"
      },
      "assetTags": [
        "bank",
        "coin",
        "chart",
        "factory",
        "globe"
      ],
      "backgroundMode": "mesh",
      "networkNodes": [
        "State",
        "Market",
        "Labor",
        "Capital",
        "Public"
      ]
    },
    {
      "text": "Cause layer 1",
      "subtext": "At its core, this is what fuels the entire process.",
      "duration": 300,
      "visual": "bars",
      "action": "slow_zoom_in",
      "category": "MONEY & ECONOMICS",
      "accentColor": "#22c55e",
      "palette": {
        "background": "#052e16",
        "secondary": "#14532d"
      },
      "assetTags": [
        "bank",
        "coin",
        "chart",
        "factory",
        "globe"
      ],
      "barValues": [
        27,
        35,
        45,
        56,
        67
      ]
    },
    {
      "text": "Cause layer 2",
      "subtext": "Tracing the flow of cause and effect.",
      "duration": 300,
      "visual": "flow",
      "action": "pan_left",
      "category": "MONEY & ECONOMICS",
      "accentColor": "#22c55e",
      "palette": {
        "background": "#052e16",
        "secondary": "#14532d"
      },
      "assetTags": [
        "bank",
        "coin",
        "chart",
        "factory",
        "globe"
      ],
      "flowLabels": [
        "Trigger",
        "Mechanism",
        "Outcome"
      ]
    },
    {
      "text": "Cause layer 3",
      "subtext": "Feedback loops that exponentially amplify or dampen the baseline.",
      "duration": 300,
      "visual": "lattice",
      "action": "dramatic_pull_back",
      "category": "MONEY & ECONOMICS",
      "accentColor": "#22c55e",
      "palette": {
        "background": "#052e16",
        "secondary": "#14532d"
      },
      "assetTags": [
        "bank",
        "coin",
        "chart",
        "factory",
        "globe"
      ],
      "weather": "rain"
    },
    {
      "text": "Data lens",
      "subtext": "The numbers tell a distinctly different story.",
      "duration": 300,
      "visual": "bars",
      "action": "slow_pan_up",
      "category": "MONEY & ECONOMICS",
      "accentColor": "#22c55e",
      "palette": {
        "background": "#052e16",
        "secondary": "#14532d"
      },
      "assetTags": [
        "bank",
        "coin",
        "chart",
        "factory",
        "globe"
      ],
      "barValues": [
        30,
        38,
        48,
        59,
        70
      ]
    },
    {
      "text": "Real world scene",
      "subtext": "How this institutional flow dictates market realities.",
      "duration": 300,
      "visual": "city",
      "action": "pan_right",
      "category": "MONEY & ECONOMICS",
      "accentColor": "#22c55e",
      "palette": {
        "background": "#052e16",
        "secondary": "#14532d"
      },
      "assetTags": [
        "bank",
        "coin",
        "chart",
        "factory",
        "globe"
      ]
    },
    {
      "text": "Ecology/externalities",
      "subtext": "Tracing the unintended environmental consequences.",
      "duration": 300,
      "visual": "animals",
      "action": "slow_zoom_in",
      "category": "MONEY & ECONOMICS",
      "accentColor": "#22c55e",
      "palette": {
        "background": "#052e16",
        "secondary": "#14532d"
      },
      "assetTags": [
        "bank",
        "coin",
        "chart",
        "factory",
        "globe"
      ],
      "animals": [
        "bird",
        "fish",
        "bee"
      ]
    },
    {
      "text": "Macro trend",
      "subtext": "Where this trajectory implies we are headed next.",
      "duration": 300,
      "visual": "earth",
      "action": "slow_pan_down",
      "category": "MONEY & ECONOMICS",
      "accentColor": "#22c55e",
      "palette": {
        "background": "#052e16",
        "secondary": "#14532d"
      },
      "assetTags": [
        "bank",
        "coin",
        "chart",
        "factory",
        "globe"
      ],
      "backgroundMode": "terrain"
    },
    {
      "text": "Actionable takeaway",
      "subtext": "Leveraging this architecture for positive outcomes.",
      "duration": 300,
      "visual": "icons",
      "action": "dramatic_pull_back",
      "category": "MONEY & ECONOMICS",
      "accentColor": "#22c55e",
      "palette": {
        "background": "#052e16",
        "secondary": "#14532d"
      },
      "assetTags": [
        "bank",
        "coin",
        "chart",
        "factory",
        "globe"
      ],
      "icons": [
        "bank",
        "coin",
        "chart",
        "bank",
        "factory",
        "home",
        "PropDeclarativeRobot",
        "PropServer",
        "PropDeclarativeSaturn"
      ]
    },
    {
      "text": "Closing",
      "subtext": "Understanding the architecture of our reality.",
      "duration": 300,
      "visual": "crowd",
      "action": "slow_zoom_in",
      "category": "MONEY & ECONOMICS",
      "accentColor": "#22c55e",
      "palette": {
        "background": "#052e16",
        "secondary": "#14532d"
      },
      "assetTags": [
        "bank",
        "coin",
        "chart",
        "factory",
        "globe"
      ],
      "crowdCount": 10,
      "mood": "happy"
    }
  ]
}
